{
  "schema_version": "temple.init/v1",
  "project": {
    "id": "sample-product",
    "name": "Sample Product"
  },
  "naming_mode": "manual",
  "agents": [
    {
      "display_name": "Alex",
      "positions": ["engineering_manager", "release_manager", "observer"]
    },
    {
      "display_name": "Jordan",
      "positions": ["product_manager", "ux_designer", "ui_designer"]
    },
    {
      "display_name": "Morgan",
      "positions": ["tech_lead"]
    },
    {
      "display_name": "Casey",
      "positions": ["developer"]
    },
    {
      "display_name": "Riley",
      "positions": ["quality_evaluator", "independent_qa"]
    }
  ]
}
